[INFO] Scanning for projects...
[INFO] 
[INFO] --------------------< cs.msu.edu:CSCI_440_Project >---------------------
[INFO] Building CSCI_440_Project 1.0-SNAPSHOT
[INFO] --------------------------------[ jar ]---------------------------------
[INFO] 
[INFO] --- maven-resources-plugin:2.6:resources (default-resources) @ CSCI_440_Project ---
[WARNING] Using platform encoding (UTF-8 actually) to copy filtered resources, i.e. build is platform dependent!
[INFO] Copying 33 resources
[INFO] 
[INFO] --- maven-compiler-plugin:3.1:compile (default-compile) @ CSCI_440_Project ---
[INFO] Nothing to compile - all classes are up to date
[INFO] 
[INFO] --- maven-resources-plugin:2.6:testResources (default-testResources) @ CSCI_440_Project ---
[WARNING] Using platform encoding (UTF-8 actually) to copy filtered resources, i.e. build is platform dependent!
[INFO] skip non existing resourceDirectory /Users/carson/Projects/msu/demo/csci-440-fall2022-private/grading/scripts/repos/kruize_christensen/src/test/resources
[INFO] 
[INFO] --- maven-compiler-plugin:3.1:testCompile (default-testCompile) @ CSCI_440_Project ---
[INFO] Nothing to compile - all classes are up to date
[INFO] 
[INFO] --- maven-surefire-plugin:2.22.1:test (default-test) @ CSCI_440_Project ---
[INFO] 
[INFO] -------------------------------------------------------
[INFO]  T E S T S
[INFO] -------------------------------------------------------
[INFO] Running edu.montana.csci.csci440.model.InvoicesTest
Resetting DB After Test...
Resetting DB After Test...
Resetting DB After Test...
[ERROR] Tests run: 3, Failures: 2, Errors: 0, Skipped: 0, Time elapsed: 0.319 s <<< FAILURE! - in edu.montana.csci.csci440.model.InvoicesTest
[ERROR] testInvoiceFieldsLoad  Time elapsed: 0.305 s  <<< FAILURE!
org.opentest4j.AssertionFailedError: expected: <Stuttgart> but was: <null>
	at edu.montana.csci.csci440.model.InvoicesTest.testInvoiceFieldsLoad(InvoicesTest.java:22)

[ERROR] testPagingWorks  Time elapsed: 0.004 s  <<< FAILURE!
org.opentest4j.AssertionFailedError: expected: <5> but was: <412>
	at edu.montana.csci.csci440.model.InvoicesTest.testPagingWorks(InvoicesTest.java:27)

[INFO] Running edu.montana.csci.csci440.model.TrackTest
Resetting DB After Test...
Resetting DB After Test...
Resetting DB After Test...
Resetting DB After Test...
Resetting DB After Test...
Resetting DB After Test...
Resetting DB After Test...
Resetting DB After Test...
Resetting DB After Test...
Resetting DB After Test...
Resetting DB After Test...
Resetting DB After Test...
[ERROR] Tests run: 12, Failures: 7, Errors: 4, Skipped: 0, Time elapsed: 0.033 s <<< FAILURE! - in edu.montana.csci.csci440.model.TrackTest
[ERROR] testAlbumNameIsStoredOnTrack  Time elapsed: 0 s  <<< FAILURE!
org.opentest4j.AssertionFailedError: expected: <4> but was: <5>
	at edu.montana.csci.csci440.model.TrackTest.testAlbumNameIsStoredOnTrack(TrackTest.java:96)

[ERROR] testOrderByWorks  Time elapsed: 0 s  <<< FAILURE!
org.opentest4j.AssertionFailedError: expected: <É Uma Partida De Futebol> but was: <For Those About To Rock (We Salute You)>
	at edu.montana.csci.csci440.model.TrackTest.testOrderByWorks(TrackTest.java:102)

[ERROR] testDeleteWorks  Time elapsed: 0 s  <<< ERROR!
java.lang.UnsupportedOperationException: Needs to be implemented
	at edu.montana.csci.csci440.model.TrackTest.testDeleteWorks(TrackTest.java:50)

[ERROR] testTrackListsWorks  Time elapsed: 0.002 s  <<< FAILURE!
org.opentest4j.AssertionFailedError: expected: <3> but was: <0>
	at edu.montana.csci.csci440.model.TrackTest.testTrackListsWorks(TrackTest.java:108)

[ERROR] testUpdateWorks  Time elapsed: 0.002 s  <<< ERROR!
java.lang.UnsupportedOperationException: Needs to be implemented
	at edu.montana.csci.csci440.model.TrackTest.testUpdateWorks(TrackTest.java:77)

[ERROR] testCreateWorks  Time elapsed: 0.002 s  <<< ERROR!
java.lang.UnsupportedOperationException: Needs to be implemented
	at edu.montana.csci.csci440.model.TrackTest.testCreateWorks(TrackTest.java:36)

[ERROR] advancedSearchTest  Time elapsed: 0.003 s  <<< FAILURE!
org.opentest4j.AssertionFailedError: expected: <3> but was: <8>
	at edu.montana.csci.csci440.model.TrackTest.advancedSearchTest(TrackTest.java:145)

[ERROR] testValidationWorks  Time elapsed: 0.001 s  <<< ERROR!
java.lang.UnsupportedOperationException: Needs to be implemented
	at edu.montana.csci.csci440.model.TrackTest.testValidationWorks(TrackTest.java:61)

[ERROR] trackCountIsCachedInRedis  Time elapsed: 0.002 s  <<< FAILURE!
org.opentest4j.AssertionFailedError: expected: <16> but was: <17>
	at edu.montana.csci.csci440.model.TrackTest.trackCountIsCachedInRedis(TrackTest.java:120)

[ERROR] testPagingWorks  Time elapsed: 0.009 s  <<< FAILURE!
org.opentest4j.AssertionFailedError: expected: <503> but was: <1000>
	at edu.montana.csci.csci440.model.TrackTest.testPagingWorks(TrackTest.java:24)

[ERROR] testArtistNameIsStoredOnTrack  Time elapsed: 0.002 s  <<< FAILURE!
org.opentest4j.AssertionFailedError: expected: <22> but was: <24>
	at edu.montana.csci.csci440.model.TrackTest.testArtistNameIsStoredOnTrack(TrackTest.java:87)

[INFO] Running edu.montana.csci.csci440.model.PlaylistsTest
Resetting DB After Test...
Resetting DB After Test...
Resetting DB After Test...
[ERROR] Tests run: 3, Failures: 2, Errors: 0, Skipped: 0, Time elapsed: 0.002 s <<< FAILURE! - in edu.montana.csci.csci440.model.PlaylistsTest
[ERROR] testPlaylistFieldsLoad  Time elapsed: 0 s  <<< FAILURE!
org.opentest4j.AssertionFailedError: expected: <213> but was: <0>
	at edu.montana.csci.csci440.model.PlaylistsTest.testPlaylistFieldsLoad(PlaylistsTest.java:22)

[ERROR] testPagingWorks  Time elapsed: 0.002 s  <<< FAILURE!
org.opentest4j.AssertionFailedError: expected: <5> but was: <18>
	at edu.montana.csci.csci440.model.PlaylistsTest.testPagingWorks(PlaylistsTest.java:28)

[INFO] Running edu.montana.csci.csci440.model.AlbumTest
Resetting DB After Test...
Resetting DB After Test...
Resetting DB After Test...
Resetting DB After Test...
Resetting DB After Test...
[ERROR] Tests run: 5, Failures: 1, Errors: 3, Skipped: 0, Time elapsed: 0.007 s <<< FAILURE! - in edu.montana.csci.csci440.model.AlbumTest
[ERROR] testUpdateWorks  Time elapsed: 0.001 s  <<< ERROR!
java.lang.UnsupportedOperationException: Needs to be implemented
	at edu.montana.csci.csci440.model.AlbumTest.testUpdateWorks(AlbumTest.java:60)

[ERROR] testCreateWorks  Time elapsed: 0.002 s  <<< ERROR!
java.lang.UnsupportedOperationException: Needs to be implemented
	at edu.montana.csci.csci440.model.AlbumTest.testCreateWorks(AlbumTest.java:35)

[ERROR] testValidationWorks  Time elapsed: 0.001 s  <<< ERROR!
java.lang.UnsupportedOperationException: Needs to be implemented
	at edu.montana.csci.csci440.model.AlbumTest.testValidationWorks(AlbumTest.java:45)

[ERROR] testPagingWorks  Time elapsed: 0.003 s  <<< FAILURE!
org.opentest4j.AssertionFailedError: expected: <47> but was: <100>
	at edu.montana.csci.csci440.model.AlbumTest.testPagingWorks(AlbumTest.java:23)

[INFO] Running edu.montana.csci.csci440.model.EmployeeTest
Resetting DB After Test...
Resetting DB After Test...
Resetting DB After Test...
Resetting DB After Test...
Resetting DB After Test...
Resetting DB After Test...
Resetting DB After Test...
[ERROR] Tests run: 7, Failures: 4, Errors: 2, Skipped: 0, Time elapsed: 0.019 s <<< FAILURE! - in edu.montana.csci.csci440.model.EmployeeTest
[ERROR] testUpdateWorks  Time elapsed: 0.002 s  <<< ERROR!
java.lang.UnsupportedOperationException: Implement me
	at edu.montana.csci.csci440.model.EmployeeTest.testUpdateWorks(EmployeeTest.java:79)

[ERROR] testCreateWorks  Time elapsed: 0.004 s  <<< FAILURE!
org.opentest4j.AssertionFailedError: expected: <edu.montana.csci.csci440.model.Employee@d1c82101> but was: <null>
	at edu.montana.csci.csci440.model.EmployeeTest.testCreateWorks(EmployeeTest.java:46)

[ERROR] testValidationWorks  Time elapsed: 0.002 s  <<< FAILURE!
org.opentest4j.AssertionFailedError: expected: <3> but was: <2>
	at edu.montana.csci.csci440.model.EmployeeTest.testValidationWorks(EmployeeTest.java:54)

[ERROR] testPagingWorks  Time elapsed: 0.002 s  <<< FAILURE!
org.opentest4j.AssertionFailedError: expected: <0> but was: <2>
	at edu.montana.csci.csci440.model.EmployeeTest.testPagingWorks(EmployeeTest.java:28)

[ERROR] testEmployeeHelperOnlyIssuesOneQuery  Time elapsed: 0.006 s  <<< FAILURE!
org.opentest4j.AssertionFailedError: expected: <true> but was: <false>
	at edu.montana.csci.csci440.model.EmployeeTest.testEmployeeHelperOnlyIssuesOneQuery(EmployeeTest.java:88)

[ERROR] testEmployeeSalesReport  Time elapsed: 0.001 s  <<< ERROR!
java.lang.IndexOutOfBoundsException: Index: 0
	at edu.montana.csci.csci440.model.EmployeeTest.testEmployeeSalesReport(EmployeeTest.java:94)

[INFO] Running edu.montana.csci.csci440.model.ArtistTest
Resetting DB After Test...
Resetting DB After Test...
Resetting DB After Test...
Resetting DB After Test...
Resetting DB After Test...
Resetting DB After Test...
[ERROR] Tests run: 6, Failures: 1, Errors: 4, Skipped: 0, Time elapsed: 0.01 s <<< FAILURE! - in edu.montana.csci.csci440.model.ArtistTest
[ERROR] testUpdateWorks  Time elapsed: 0.001 s  <<< ERROR!
java.lang.UnsupportedOperationException: Needs to be implemented
	at edu.montana.csci.csci440.model.ArtistTest.testUpdateWorks(ArtistTest.java:75)

[ERROR] testCreateWorks  Time elapsed: 0.002 s  <<< ERROR!
java.lang.UnsupportedOperationException: Needs to be implemented
	at edu.montana.csci.csci440.model.ArtistTest.testCreateWorks(ArtistTest.java:34)

[ERROR] testValidationWorks  Time elapsed: 0.001 s  <<< ERROR!
java.lang.UnsupportedOperationException: Needs to be implemented
	at edu.montana.csci.csci440.model.ArtistTest.testValidationWorks(ArtistTest.java:61)

[ERROR] testPagingWorks  Time elapsed: 0.002 s  <<< FAILURE!
org.opentest4j.AssertionFailedError: expected: <75> but was: <100>
	at edu.montana.csci.csci440.model.ArtistTest.testPagingWorks(ArtistTest.java:22)

[ERROR] testOptimisticConcurrencyIsImplemented  Time elapsed: 0.002 s  <<< ERROR!
java.lang.UnsupportedOperationException: Needs to be implemented
	at edu.montana.csci.csci440.model.ArtistTest.testOptimisticConcurrencyIsImplemented(ArtistTest.java:49)

[INFO] Running edu.montana.csci.csci440.model.CustomerTest
Resetting DB After Test...
Resetting DB After Test...
Resetting DB After Test...
[ERROR] Tests run: 3, Failures: 2, Errors: 0, Skipped: 0, Time elapsed: 0.007 s <<< FAILURE! - in edu.montana.csci.csci440.model.CustomerTest
[ERROR] testCustomerFieldsLoad  Time elapsed: 0.002 s  <<< FAILURE!
org.opentest4j.AssertionFailedError: expected: <luisg@embraer.com.br> but was: <null>
	at edu.montana.csci.csci440.model.CustomerTest.testCustomerFieldsLoad(CustomerTest.java:21)

[ERROR] testPagingWorks  Time elapsed: 0.002 s  <<< FAILURE!
org.opentest4j.AssertionFailedError: expected: <25> but was: <59>
	at edu.montana.csci.csci440.model.CustomerTest.testPagingWorks(CustomerTest.java:26)

[INFO] 
[INFO] Results:
[INFO] 
[ERROR] Failures: 
[ERROR]   AlbumTest.testPagingWorks:23 expected: <47> but was: <100>
[ERROR]   ArtistTest.testPagingWorks:22 expected: <75> but was: <100>
[ERROR]   CustomerTest.testCustomerFieldsLoad:21 expected: <luisg@embraer.com.br> but was: <null>
[ERROR]   CustomerTest.testPagingWorks:26 expected: <25> but was: <59>
[ERROR]   EmployeeTest.testCreateWorks:46 expected: <edu.montana.csci.csci440.model.Employee@d1c82101> but was: <null>
[ERROR]   EmployeeTest.testEmployeeHelperOnlyIssuesOneQuery:88 expected: <true> but was: <false>
[ERROR]   EmployeeTest.testPagingWorks:28 expected: <0> but was: <2>
[ERROR]   EmployeeTest.testValidationWorks:54 expected: <3> but was: <2>
[ERROR]   InvoicesTest.testInvoiceFieldsLoad:22 expected: <Stuttgart> but was: <null>
[ERROR]   InvoicesTest.testPagingWorks:27 expected: <5> but was: <412>
[ERROR]   PlaylistsTest.testPagingWorks:28 expected: <5> but was: <18>
[ERROR]   PlaylistsTest.testPlaylistFieldsLoad:22 expected: <213> but was: <0>
[ERROR]   TrackTest.advancedSearchTest:145 expected: <3> but was: <8>
[ERROR]   TrackTest.testAlbumNameIsStoredOnTrack:96 expected: <4> but was: <5>
[ERROR]   TrackTest.testArtistNameIsStoredOnTrack:87 expected: <22> but was: <24>
[ERROR]   TrackTest.testOrderByWorks:102 expected: <É Uma Partida De Futebol> but was: <For Those About To Rock (We Salute You)>
[ERROR]   TrackTest.testPagingWorks:24 expected: <503> but was: <1000>
[ERROR]   TrackTest.testTrackListsWorks:108 expected: <3> but was: <0>
[ERROR]   TrackTest.trackCountIsCachedInRedis:120 expected: <16> but was: <17>
[ERROR] Errors: 
[ERROR]   AlbumTest.testCreateWorks:35 » UnsupportedOperation Needs to be implemented
[ERROR]   AlbumTest.testUpdateWorks:60 » UnsupportedOperation Needs to be implemented
[ERROR]   AlbumTest.testValidationWorks:45 » UnsupportedOperation Needs to be implemente...
[ERROR]   ArtistTest.testCreateWorks:34 » UnsupportedOperation Needs to be implemented
[ERROR]   ArtistTest.testOptimisticConcurrencyIsImplemented:49 » UnsupportedOperation Ne...
[ERROR]   ArtistTest.testUpdateWorks:75 » UnsupportedOperation Needs to be implemented
[ERROR]   ArtistTest.testValidationWorks:61 » UnsupportedOperation Needs to be implement...
[ERROR]   EmployeeTest.testEmployeeSalesReport:94 » IndexOutOfBounds Index: 0
[ERROR]   EmployeeTest.testUpdateWorks:79 » UnsupportedOperation Implement me
[ERROR]   TrackTest.testCreateWorks:36 » UnsupportedOperation Needs to be implemented
[ERROR]   TrackTest.testDeleteWorks:50 » UnsupportedOperation Needs to be implemented
[ERROR]   TrackTest.testUpdateWorks:77 » UnsupportedOperation Needs to be implemented
[ERROR]   TrackTest.testValidationWorks:61 » UnsupportedOperation Needs to be implemente...
[INFO] 
[ERROR] Tests run: 39, Failures: 19, Errors: 13, Skipped: 0
[INFO] 
[INFO] ------------------------------------------------------------------------
[INFO] BUILD FAILURE
[INFO] ------------------------------------------------------------------------
[INFO] Total time:  1.420 s
[INFO] Finished at: 2022-12-07T10:59:52-07:00
[INFO] ------------------------------------------------------------------------
[ERROR] Failed to execute goal org.apache.maven.plugins:maven-surefire-plugin:2.22.1:test (default-test) on project CSCI_440_Project: There are test failures.
[ERROR] 
[ERROR] Please refer to /Users/carson/Projects/msu/demo/csci-440-fall2022-private/grading/scripts/repos/kruize_christensen/target/surefire-reports for the individual test results.
[ERROR] Please refer to dump files (if any exist) [date].dump, [date]-jvmRun[N].dump and [date].dumpstream.
[ERROR] -> [Help 1]
[ERROR] 
[ERROR] To see the full stack trace of the errors, re-run Maven with the -e switch.
[ERROR] Re-run Maven using the -X switch to enable full debug logging.
[ERROR] 
[ERROR] For more information about the errors and possible solutions, please read the following articles:
[ERROR] [Help 1] http://cwiki.apache.org/confluence/display/MAVEN/MojoFailureException
